[
  {
    "id": "moonlit_gate_001",
    "region": "moonlit_gate",
    "name": "Moonlit Threshold",
    "width": 960,
    "height": 270,
    "map": {
      "x": 0,
      "y": 0
    },
    "music": "moonlit_gate",
    "ambience": "wind_night",
    "exits": [
      {
        "id": "mg001_east",
        "dir": "east",
        "x": 944,
        "y": 170,
        "w": 16,
        "h": 80,
        "target": "moonlit_gate_002",
        "spawn": {
          "x": 30,
          "y": 236,
          "facing": 1
        }
      }
    ],
    "playerStart": {
      "x": 120,
      "y": 236,
      "facing": 1
    },
    "geometry": {
      "solids": [
        {
          "x": 0,
          "y": 240,
          "w": 960,
          "h": 30
        }
      ]
    },
    "pickups": [
      {
        "itemId": "ember_tonic",
        "quantity": 1,
        "x": 200,
        "y": 200
      }
    ],
    "breakables": [
      {
        "kind": "candle",
        "x": 120,
        "y": 224
      },
      {
        "kind": "candle",
        "x": 840,
        "y": 224
      }
    ],
    "checkpoints": [
      {
        "id": "mg001_threshold",
        "x": 120,
        "y": 236
      }
    ]
  },
  {
    "id": "moonlit_gate_002",
    "region": "moonlit_gate",
    "name": "Lantern Court",
    "width": 960,
    "height": 270,
    "map": {
      "x": 1,
      "y": 0
    },
    "music": "moonlit_gate",
    "ambience": "wind_night",
    "exits": [
      {
        "id": "mg002_west",
        "dir": "west",
        "x": 0,
        "y": 170,
        "w": 16,
        "h": 80,
        "target": "moonlit_gate_001",
        "spawn": {
          "x": 930,
          "y": 236,
          "facing": -1
        }
      },
      {
        "id": "mg002_east",
        "dir": "east",
        "x": 944,
        "y": 170,
        "w": 16,
        "h": 80,
        "target": "moonlit_gate_004",
        "spawn": {
          "x": 30,
          "y": 236,
          "facing": 1
        }
      },
      {
        "id": "mg002_ledge",
        "dir": "up",
        "x": 440,
        "y": 0,
        "w": 80,
        "h": 24,
        "target": "moonlit_gate_003",
        "spawn": {
          "x": 360,
          "y": 236,
          "facing": 1
        },
        "requires": [
          "moonrise_leap"
        ],
        "hint": "The ledge is beyond your reach \u2014 moonlight might lend you wings."
      }
    ],
    "geometry": {
      "solids": [
        {
          "x": 0,
          "y": 240,
          "w": 960,
          "h": 30
        }
      ],
      "oneway": [
        {
          "x": 420,
          "y": 170,
          "w": 120
        }
      ]
    },
    "pickups": [
      {
        "itemId": "recruit_blade",
        "quantity": 1,
        "x": 480,
        "y": 190,
        "chest": true
      }
    ],
    "breakables": [
      {
        "kind": "candle",
        "x": 300,
        "y": 224
      },
      {
        "kind": "candle",
        "x": 660,
        "y": 224
      },
      {
        "kind": "urn",
        "x": 140,
        "y": 224
      },
      {
        "kind": "urn",
        "x": 820,
        "y": 224
      }
    ],
    "checkpoints": [
      {
        "id": "mg002_lantern",
        "x": 480,
        "y": 236
      }
    ],
    "saveRoom": true
  },
  {
    "id": "moonlit_gate_003",
    "region": "moonlit_gate",
    "name": "Starlit Overlook",
    "width": 720,
    "height": 270,
    "map": {
      "x": 1,
      "y": -1
    },
    "music": "moonlit_gate",
    "ambience": "wind_night",
    "exits": [
      {
        "id": "mg003_down",
        "dir": "down",
        "x": 320,
        "y": 254,
        "w": 80,
        "h": 16,
        "target": "moonlit_gate_002",
        "spawn": {
          "x": 480,
          "y": 60,
          "facing": 1
        }
      },
      {
        "id": "mg003_east",
        "dir": "east",
        "x": 704,
        "y": 170,
        "w": 16,
        "h": 80,
        "target": "moonlit_gate_005",
        "spawn": {
          "x": 30,
          "y": 236,
          "facing": 1
        }
      }
    ],
    "geometry": {
      "solids": [
        {
          "x": 0,
          "y": 240,
          "w": 720,
          "h": 30
        }
      ],
      "oneway": [
        {
          "x": 470,
          "y": 160,
          "w": 120
        }
      ]
    },
    "enemies": [
      {
        "id": "cinder_wisp",
        "x": 300,
        "y": 240
      },
      {
        "id": "cinder_wisp",
        "x": 530,
        "y": 160
      }
    ],
    "breakables": [
      {
        "kind": "candle",
        "x": 120,
        "y": 224
      },
      {
        "kind": "urn",
        "x": 620,
        "y": 224
      }
    ],
    "secrets": [
      {
        "id": "mg003_overlook_cache",
        "kind": "hidden_floor",
        "x": 490,
        "y": 150,
        "w": 80,
        "h": 20,
        "reward": {
          "itemId": "dusk_hood",
          "quantity": 1
        }
      }
    ]
  },
  {
    "id": "moonlit_gate_004",
    "region": "moonlit_gate",
    "name": "Warded Passage",
    "width": 960,
    "height": 270,
    "map": {
      "x": 2,
      "y": 0
    },
    "music": "moonlit_gate",
    "ambience": "wind_night",
    "exits": [
      {
        "id": "mg004_west",
        "dir": "west",
        "x": 0,
        "y": 170,
        "w": 16,
        "h": 80,
        "target": "moonlit_gate_002",
        "spawn": {
          "x": 930,
          "y": 236,
          "facing": -1
        }
      },
      {
        "id": "mg004_gate",
        "dir": "east",
        "x": 944,
        "y": 150,
        "w": 16,
        "h": 100,
        "target": "moonlit_gate_007",
        "spawn": {
          "x": 30,
          "y": 236,
          "facing": 1
        },
        "requiresItem": "moonstone_charm",
        "hint": "A ward of cold moonlight seals the gate."
      },
      {
        "id": "mg004_south",
        "dir": "south",
        "x": 440,
        "y": 254,
        "w": 80,
        "h": 16,
        "target": "moonlit_gate_005",
        "spawn": {
          "x": 500,
          "y": 40,
          "facing": 1
        }
      }
    ],
    "geometry": {
      "solids": [
        {
          "x": 0,
          "y": 240,
          "w": 960,
          "h": 30
        }
      ]
    },
    "enemies": [
      {
        "id": "ash_hound",
        "x": 300,
        "y": 240
      },
      {
        "id": "ash_hound",
        "x": 700,
        "y": 240
      },
      {
        "id": "rustbound_revenant",
        "x": 540,
        "y": 240
      }
    ],
    "pickups": [
      {
        "itemId": "ember_tonic",
        "quantity": 1,
        "x": 800,
        "y": 200
      }
    ],
    "breakables": [
      {
        "kind": "urn",
        "x": 200,
        "y": 224
      },
      {
        "kind": "urn",
        "x": 480,
        "y": 224
      },
      {
        "kind": "urn",
        "x": 760,
        "y": 224
      },
      {
        "kind": "crate",
        "x": 1080,
        "y": 224
      }
    ]
  },
  {
    "id": "moonlit_gate_005",
    "region": "moonlit_gate",
    "name": "Ashen Cloister",
    "width": 1440,
    "height": 270,
    "map": {
      "x": 2,
      "y": 1
    },
    "music": "moonlit_gate",
    "ambience": "wind_night",
    "exits": [
      {
        "id": "mg005_north",
        "dir": "north",
        "x": 460,
        "y": 0,
        "w": 80,
        "h": 24,
        "target": "moonlit_gate_004",
        "spawn": {
          "x": 480,
          "y": 230,
          "facing": 1
        }
      },
      {
        "id": "mg005_east",
        "dir": "east",
        "x": 1424,
        "y": 170,
        "w": 16,
        "h": 80,
        "target": "moonlit_gate_007",
        "spawn": {
          "x": 30,
          "y": 236,
          "facing": 1
        }
      },
      {
        "id": "mg005_cellar",
        "dir": "down",
        "x": 1300,
        "y": 235,
        "w": 60,
        "h": 35,
        "target": "moonlit_gate_006",
        "spawn": {
          "x": 360,
          "y": 60,
          "facing": 1
        },
        "secretId": "mg005_ember_hollow"
      }
    ],
    "geometry": {
      "solids": [
        {
          "x": 0,
          "y": 240,
          "w": 1440,
          "h": 30
        }
      ],
      "oneway": [
        {
          "x": 300,
          "y": 170,
          "w": 96
        },
        {
          "x": 900,
          "y": 170,
          "w": 96
        }
      ]
    },
    "enemies": [
      {
        "id": "rustbound_revenant",
        "x": 400,
        "y": 240
      },
      {
        "id": "rustbound_revenant",
        "x": 1000,
        "y": 240
      },
      {
        "id": "cinder_wisp",
        "x": 700,
        "y": 240
      }
    ],
    "pickups": [
      {
        "itemId": "vesper_draught",
        "quantity": 1,
        "x": 1050,
        "y": 200
      }
    ],
    "breakables": [
      {
        "kind": "crate",
        "x": 650,
        "y": 224
      },
      {
        "kind": "crate",
        "x": 1200,
        "y": 224
      },
      {
        "kind": "urn",
        "x": 250,
        "y": 224
      },
      {
        "kind": "urn",
        "x": 950,
        "y": 224
      },
      {
        "kind": "urn",
        "x": 1350,
        "y": 224
      }
    ],
    "secrets": [
      {
        "id": "mg005_ember_hollow",
        "kind": "hidden_floor",
        "x": 1300,
        "y": 225,
        "w": 60,
        "h": 25,
        "reward": {
          "itemId": "moonstone_charm",
          "quantity": 1
        }
      }
    ]
  },
  {
    "id": "moonlit_gate_006",
    "region": "moonlit_gate",
    "name": "Ember Hollow",
    "width": 720,
    "height": 270,
    "map": {
      "x": 3,
      "y": 1
    },
    "music": "moonlit_gate",
    "ambience": "wind_night",
    "exits": [
      {
        "id": "mg006_up",
        "dir": "up",
        "x": 330,
        "y": 0,
        "w": 80,
        "h": 24,
        "target": "moonlit_gate_005",
        "spawn": {
          "x": 1330,
          "y": 180,